
*** Running vivado
    with args -log computer.vdi -applog -m64 -product Vivado -messageDb vivado.pb -mode batch -source computer.tcl -notrace


****** Vivado v2018.3 (64-bit)
  **** SW Build 2405991 on Thu Dec  6 23:38:27 MST 2018
  **** IP Build 2404404 on Fri Dec  7 01:43:56 MST 2018
    ** Copyright 1986-2018 Xilinx, Inc. All Rights Reserved.

source computer.tcl -notrace
Command: link_design -top computer -part xc7a100tcsg324-1
Design is defaulting to srcset: sources_1
Design is defaulting to constrset: constrs_1
INFO: [Project 1-454] Reading design checkpoint 'e:/vivado/Vivado_Learning/user/ip/dist_mem_im/dist_mem_im.dcp' for cell 'U_CPU/U_IM'
INFO: [Netlist 29-17] Analyzing 338 Unisim elements for replacement
INFO: [Netlist 29-28] Unisim Transformation completed in 0 CPU seconds
INFO: [Project 1-479] Netlist was created with Vivado 2018.3
INFO: [Device 21-403] Loading part xc7a100tcsg324-1
INFO: [Project 1-570] Preparing netlist for logic optimization
Parsing XDC File [e:/vivado/Vivado_Learning/user/data/new/icf.xdc]
WARNING: [Vivado 12-507] No nets matched 'BTNC_IBUF'. [e:/vivado/Vivado_Learning/user/data/new/icf.xdc:6]
CRITICAL WARNING: [Common 17-55] 'set_property' expects at least one object. [e:/vivado/Vivado_Learning/user/data/new/icf.xdc:6]
Resolution: If [get_<value>] was used to populate the object, check to make sure this command returns at least one valid object.
WARNING: [Vivado 12-584] No ports matched 'CPU_RESETN'. [e:/vivado/Vivado_Learning/user/data/new/icf.xdc:66]
CRITICAL WARNING: [Common 17-55] 'set_property' expects at least one object. [e:/vivado/Vivado_Learning/user/data/new/icf.xdc:66]
Resolution: If [get_<value>] was used to populate the object, check to make sure this command returns at least one valid object.
WARNING: [Vivado 12-584] No ports matched 'BTNC'. [e:/vivado/Vivado_Learning/user/data/new/icf.xdc:67]
CRITICAL WARNING: [Common 17-55] 'set_property' expects at least one object. [e:/vivado/Vivado_Learning/user/data/new/icf.xdc:67]
Resolution: If [get_<value>] was used to populate the object, check to make sure this command returns at least one valid object.
WARNING: [Vivado 12-584] No ports matched 'BTNU'. [e:/vivado/Vivado_Learning/user/data/new/icf.xdc:68]
CRITICAL WARNING: [Common 17-55] 'set_property' expects at least one object. [e:/vivado/Vivado_Learning/user/data/new/icf.xdc:68]
Resolution: If [get_<value>] was used to populate the object, check to make sure this command returns at least one valid object.
WARNING: [Vivado 12-584] No ports matched 'BTNL'. [e:/vivado/Vivado_Learning/user/data/new/icf.xdc:69]
CRITICAL WARNING: [Common 17-55] 'set_property' expects at least one object. [e:/vivado/Vivado_Learning/user/data/new/icf.xdc:69]
Resolution: If [get_<value>] was used to populate the object, check to make sure this command returns at least one valid object.
WARNING: [Vivado 12-584] No ports matched 'BTNR'. [e:/vivado/Vivado_Learning/user/data/new/icf.xdc:70]
CRITICAL WARNING: [Common 17-55] 'set_property' expects at least one object. [e:/vivado/Vivado_Learning/user/data/new/icf.xdc:70]
Resolution: If [get_<value>] was used to populate the object, check to make sure this command returns at least one valid object.
WARNING: [Vivado 12-584] No ports matched 'BTND'. [e:/vivado/Vivado_Learning/user/data/new/icf.xdc:71]
CRITICAL WARNING: [Common 17-55] 'set_property' expects at least one object. [e:/vivado/Vivado_Learning/user/data/new/icf.xdc:71]
Resolution: If [get_<value>] was used to populate the object, check to make sure this command returns at least one valid object.
Finished Parsing XDC File [e:/vivado/Vivado_Learning/user/data/new/icf.xdc]
INFO: [Opt 31-138] Pushed 0 inverter(s) to 0 load pin(s).
Netlist sorting complete. Time (s): cpu = 00:00:00 ; elapsed = 00:00:00.001 . Memory (MB): peak = 711.840 ; gain = 0.000
INFO: [Project 1-111] Unisim Transformation Summary:
No Unisim elements were transformed.

8 Infos, 7 Warnings, 7 Critical Warnings and 0 Errors encountered.
link_design completed successfully
INFO: [Common 17-600] The following parameters have non-default value.
general.maxThreads
Command: opt_design
Attempting to get a license for feature 'Implementation' and/or device 'xc7a100t'
INFO: [Common 17-349] Got license for feature 'Implementation' and/or device 'xc7a100t'
Running DRC as a precondition to command opt_design

Starting DRC Task
INFO: [DRC 23-27] Running DRC with 8 threads
INFO: [Project 1-461] DRC finished with 0 Errors
INFO: [Project 1-462] Please refer to the DRC report (report_drc) for more information.

Time (s): cpu = 00:00:00 ; elapsed = 00:00:00.169 . Memory (MB): peak = 751.539 ; gain = 39.699

Starting Cache Timing Information Task
INFO: [Timing 38-35] Done setting XDC timing constraints.
Ending Cache Timing Information Task | Checksum: 159f768fd

Time (s): cpu = 00:00:05 ; elapsed = 00:00:05 . Memory (MB): peak = 1286.762 ; gain = 535.223

Starting Logic Optimization Task

Phase 1 Retarget
INFO: [Opt 31-138] Pushed 0 inverter(s) to 0 load pin(s).
INFO: [Opt 31-49] Retargeted 0 cell(s).
Phase 1 Retarget | Checksum: 17c804a44

Time (s): cpu = 00:00:00 ; elapsed = 00:00:00.326 . Memory (MB): peak = 1383.801 ; gain = 0.000
INFO: [Opt 31-389] Phase Retarget created 768 cells and removed 1292 cells

Phase 2 Constant propagation
INFO: [Opt 31-138] Pushed 2 inverter(s) to 3 load pin(s).
Phase 2 Constant propagation | Checksum: 13c163d22

Time (s): cpu = 00:00:01 ; elapsed = 00:00:00.528 . Memory (MB): peak = 1383.801 ; gain = 0.000
INFO: [Opt 31-389] Phase Constant propagation created 243 cells and removed 1573 cells

Phase 3 Sweep
Phase 3 Sweep | Checksum: 14077065e

Time (s): cpu = 00:00:01 ; elapsed = 00:00:00.643 . Memory (MB): peak = 1383.801 ; gain = 0.000
INFO: [Opt 31-389] Phase Sweep created 0 cells and removed 522 cells

Phase 4 BUFG optimization
Phase 4 BUFG optimization | Checksum: 14077065e

Time (s): cpu = 00:00:01 ; elapsed = 00:00:00.655 . Memory (MB): peak = 1383.801 ; gain = 0.000
INFO: [Opt 31-662] Phase BUFG optimization created 0 cells of which 0 are BUFGs and removed 0 cells.

Phase 5 Shift Register Optimization
Phase 5 Shift Register Optimization | Checksum: 17914bbc2

Time (s): cpu = 00:00:01 ; elapsed = 00:00:00.752 . Memory (MB): peak = 1383.801 ; gain = 0.000
INFO: [Opt 31-389] Phase Shift Register Optimization created 0 cells and removed 0 cells

Phase 6 Post Processing Netlist
Phase 6 Post Processing Netlist | Checksum: 17914bbc2

Time (s): cpu = 00:00:01 ; elapsed = 00:00:00.759 . Memory (MB): peak = 1383.801 ; gain = 0.000
INFO: [Opt 31-389] Phase Post Processing Netlist created 0 cells and removed 0 cells
Opt_design Change Summary
=========================


-------------------------------------------------------------------------------------------------------------------------
|  Phase                        |  #Cells created  |  #Cells Removed  |  #Constrained objects preventing optimizations  |
-------------------------------------------------------------------------------------------------------------------------
|  Retarget                     |             768  |            1292  |                                              0  |
|  Constant propagation         |             243  |            1573  |                                              0  |
|  Sweep                        |               0  |             522  |                                              0  |
|  BUFG optimization            |               0  |               0  |                                              0  |
|  Shift Register Optimization  |               0  |               0  |                                              0  |
|  Post Processing Netlist      |               0  |               0  |                                              0  |
-------------------------------------------------------------------------------------------------------------------------



Starting Connectivity Check Task

Time (s): cpu = 00:00:00 ; elapsed = 00:00:00.003 . Memory (MB): peak = 1383.801 ; gain = 0.000
Ending Logic Optimization Task | Checksum: 17914bbc2

Time (s): cpu = 00:00:01 ; elapsed = 00:00:00.765 . Memory (MB): peak = 1383.801 ; gain = 0.000

Starting Power Optimization Task
INFO: [Pwropt 34-132] Skipping clock gating for clocks with a period < 2.00 ns.
Ending Power Optimization Task | Checksum: 17914bbc2

Time (s): cpu = 00:00:00 ; elapsed = 00:00:00.006 . Memory (MB): peak = 1383.801 ; gain = 0.000

Starting Final Cleanup Task
Ending Final Cleanup Task | Checksum: 17914bbc2

Time (s): cpu = 00:00:00 ; elapsed = 00:00:00 . Memory (MB): peak = 1383.801 ; gain = 0.000

Starting Netlist Obfuscation Task
Netlist sorting complete. Time (s): cpu = 00:00:00 ; elapsed = 00:00:00 . Memory (MB): peak = 1383.801 ; gain = 0.000
Ending Netlist Obfuscation Task | Checksum: 17914bbc2

Time (s): cpu = 00:00:00 ; elapsed = 00:00:00 . Memory (MB): peak = 1383.801 ; gain = 0.000
INFO: [Common 17-83] Releasing license: Implementation
25 Infos, 7 Warnings, 7 Critical Warnings and 0 Errors encountered.
opt_design completed successfully
opt_design: Time (s): cpu = 00:00:07 ; elapsed = 00:00:06 . Memory (MB): peak = 1383.801 ; gain = 671.961
INFO: [Common 17-600] The following parameters have non-default value.
general.maxThreads
Netlist sorting complete. Time (s): cpu = 00:00:00 ; elapsed = 00:00:00 . Memory (MB): peak = 1383.801 ; gain = 0.000
INFO: [Timing 38-480] Writing timing data to binary archive.
Writing placer database...
Writing XDEF routing.
Writing XDEF routing logical nets.
Writing XDEF routing special nets.
Write XDEF Complete: Time (s): cpu = 00:00:00 ; elapsed = 00:00:00.018 . Memory (MB): peak = 1383.801 ; gain = 0.000
Netlist sorting complete. Time (s): cpu = 00:00:00 ; elapsed = 00:00:00 . Memory (MB): peak = 1383.801 ; gain = 0.000
INFO: [Common 17-1381] The checkpoint 'e:/vivado/Vivado_Learning/prj/xilinx/Vivado_Learning.runs/impl_1/computer_opt.dcp' has been generated.
INFO: [runtcl-4] Executing : report_drc -file computer_drc_opted.rpt -pb computer_drc_opted.pb -rpx computer_drc_opted.rpx
Command: report_drc -file computer_drc_opted.rpt -pb computer_drc_opted.pb -rpx computer_drc_opted.rpx
INFO: [IP_Flow 19-1839] IP Catalog is up to date.
INFO: [DRC 23-27] Running DRC with 8 threads
INFO: [Coretcl 2-168] The results of DRC are in file e:/vivado/Vivado_Learning/prj/xilinx/Vivado_Learning.runs/impl_1/computer_drc_opted.rpt.
report_drc completed successfully
Command: place_design
Attempting to get a license for feature 'Implementation' and/or device 'xc7a100t'
INFO: [Common 17-349] Got license for feature 'Implementation' and/or device 'xc7a100t'
INFO: [DRC 23-27] Running DRC with 8 threads
INFO: [Vivado_Tcl 4-198] DRC finished with 0 Errors
INFO: [Vivado_Tcl 4-199] Please refer to the DRC report (report_drc) for more information.
Running DRC as a precondition to command place_design
INFO: [DRC 23-27] Running DRC with 8 threads
INFO: [Vivado_Tcl 4-198] DRC finished with 0 Errors
INFO: [Vivado_Tcl 4-199] Please refer to the DRC report (report_drc) for more information.

Starting Placer Task
INFO: [Place 30-611] Multithreading enabled for place_design using a maximum of 8 CPUs

Phase 1 Placer Initialization

Phase 1.1 Placer Initialization Netlist Sorting
Netlist sorting complete. Time (s): cpu = 00:00:00 ; elapsed = 00:00:00.001 . Memory (MB): peak = 1383.801 ; gain = 0.000
Phase 1.1 Placer Initialization Netlist Sorting | Checksum: 87afd865

Time (s): cpu = 00:00:00 ; elapsed = 00:00:00.003 . Memory (MB): peak = 1383.801 ; gain = 0.000
Netlist sorting complete. Time (s): cpu = 00:00:00 ; elapsed = 00:00:00 . Memory (MB): peak = 1383.801 ; gain = 0.000

Phase 1.2 IO Placement/ Clock Placement/ Build Placer Device
INFO: [Timing 38-35] Done setting XDC timing constraints.
Phase 1.2 IO Placement/ Clock Placement/ Build Placer Device | Checksum: d8d2ffdc

Time (s): cpu = 00:00:02 ; elapsed = 00:00:00.402 . Memory (MB): peak = 1383.801 ; gain = 0.000

Phase 1.3 Build Placer Netlist Model
Phase 1.3 Build Placer Netlist Model | Checksum: 1c3ef53b6

Time (s): cpu = 00:00:03 ; elapsed = 00:00:00.586 . Memory (MB): peak = 1393.312 ; gain = 9.512

Phase 1.4 Constrain Clocks/Macros
Phase 1.4 Constrain Clocks/Macros | Checksum: 1c3ef53b6

Time (s): cpu = 00:00:03 ; elapsed = 00:00:00.589 . Memory (MB): peak = 1393.312 ; gain = 9.512
Phase 1 Placer Initialization | Checksum: 1c3ef53b6

Time (s): cpu = 00:00:03 ; elapsed = 00:00:00.590 . Memory (MB): peak = 1393.312 ; gain = 9.512

Phase 2 Global Placement

Phase 2.1 Floorplanning
Phase 2.1 Floorplanning | Checksum: 142195a4d

Time (s): cpu = 00:00:03 ; elapsed = 00:00:00.675 . Memory (MB): peak = 1393.312 ; gain = 9.512

Phase 2.2 Physical Synthesis In Placer
INFO: [Physopt 32-65] No nets found for high-fanout optimization.
INFO: [Physopt 32-232] Optimized 0 net. Created 0 new instance.
INFO: [Physopt 32-775] End 1 Pass. Optimized 0 net or cell. Created 0 new cell, deleted 0 existing cell and moved 0 existing cell
INFO: [Physopt 32-670] No setup violation found.  DSP Register Optimization was not performed.
INFO: [Physopt 32-670] No setup violation found.  Shift Register Optimization was not performed.
INFO: [Physopt 32-670] No setup violation found.  BRAM Register Optimization was not performed.
INFO: [Physopt 32-949] No candidate nets found for HD net replication
INFO: [Physopt 32-775] End 1 Pass. Optimized 0 net or cell. Created 0 new cell, deleted 0 existing cell and moved 0 existing cell
Netlist sorting complete. Time (s): cpu = 00:00:00 ; elapsed = 00:00:00 . Memory (MB): peak = 1393.312 ; gain = 0.000

Summary of Physical Synthesis Optimizations
============================================


----------------------------------------------------------------------------------------------------------------------------------------
|  Optimization                  |  Added Cells  |  Removed Cells  |  Optimized Cells/Nets  |  Dont Touch  |  Iterations  |  Elapsed   |
----------------------------------------------------------------------------------------------------------------------------------------
|  Very High Fanout              |            0  |              0  |                     0  |           0  |           1  |  00:00:00  |
|  DSP Register                  |            0  |              0  |                     0  |           0  |           0  |  00:00:00  |
|  Shift Register                |            0  |              0  |                     0  |           0  |           0  |  00:00:00  |
|  BRAM Register                 |            0  |              0  |                     0  |           0  |           0  |  00:00:00  |
|  HD Interface Net Replication  |            0  |              0  |                     0  |           0  |           1  |  00:00:00  |
|  Total                         |            0  |              0  |                     0  |           0  |           2  |  00:00:00  |
----------------------------------------------------------------------------------------------------------------------------------------


Phase 2.2 Physical Synthesis In Placer | Checksum: 10dd8b743

Time (s): cpu = 00:00:11 ; elapsed = 00:00:03 . Memory (MB): peak = 1393.312 ; gain = 9.512
Phase 2 Global Placement | Checksum: 1b0885ea2

Time (s): cpu = 00:00:12 ; elapsed = 00:00:03 . Memory (MB): peak = 1393.312 ; gain = 9.512

Phase 3 Detail Placement

Phase 3.1 Commit Multi Column Macros
Phase 3.1 Commit Multi Column Macros | Checksum: 1b0885ea2

Time (s): cpu = 00:00:12 ; elapsed = 00:00:03 . Memory (MB): peak = 1393.312 ; gain = 9.512

Phase 3.2 Commit Most Macros & LUTRAMs
Phase 3.2 Commit Most Macros & LUTRAMs | Checksum: 2280b83f8

Time (s): cpu = 00:00:12 ; elapsed = 00:00:03 . Memory (MB): peak = 1393.312 ; gain = 9.512

Phase 3.3 Area Swap Optimization
Phase 3.3 Area Swap Optimization | Checksum: 1c6f7f216

Time (s): cpu = 00:00:12 ; elapsed = 00:00:03 . Memory (MB): peak = 1393.312 ; gain = 9.512

Phase 3.4 Pipeline Register Optimization
Phase 3.4 Pipeline Register Optimization | Checksum: 1eb7ead62

Time (s): cpu = 00:00:12 ; elapsed = 00:00:03 . Memory (MB): peak = 1393.312 ; gain = 9.512

Phase 3.5 Small Shape Detail Placement
Phase 3.5 Small Shape Detail Placement | Checksum: 1b0614065

Time (s): cpu = 00:00:14 ; elapsed = 00:00:04 . Memory (MB): peak = 1393.312 ; gain = 9.512

Phase 3.6 Re-assign LUT pins
Phase 3.6 Re-assign LUT pins | Checksum: 10c5c5803

Time (s): cpu = 00:00:14 ; elapsed = 00:00:04 . Memory (MB): peak = 1393.312 ; gain = 9.512

Phase 3.7 Pipeline Register Optimization
Phase 3.7 Pipeline Register Optimization | Checksum: 130d99c57

Time (s): cpu = 00:00:14 ; elapsed = 00:00:04 . Memory (MB): peak = 1393.312 ; gain = 9.512
Phase 3 Detail Placement | Checksum: 130d99c57

Time (s): cpu = 00:00:14 ; elapsed = 00:00:04 . Memory (MB): peak = 1393.312 ; gain = 9.512

Phase 4 Post Placement Optimization and Clean-Up

Phase 4.1 Post Commit Optimization
INFO: [Timing 38-35] Done setting XDC timing constraints.

Phase 4.1.1 Post Placement Optimization
Post Placement Optimization Initialization | Checksum: 1344ae3d7

Phase 4.1.1.1 BUFG Insertion
INFO: [Place 46-46] BUFG insertion identified 0 candidate nets, 0 success, 0 bufg driver replicated, 0 skipped for placement/routing, 0 skipped for timing, 0 skipped for netlist change reason
Phase 4.1.1.1 BUFG Insertion | Checksum: 1344ae3d7

Time (s): cpu = 00:00:15 ; elapsed = 00:00:04 . Memory (MB): peak = 1399.926 ; gain = 16.125
INFO: [Place 30-746] Post Placement Timing Summary WNS=96.807. For the most accurate timing information please run report_timing.
Phase 4.1.1 Post Placement Optimization | Checksum: d164da29

Time (s): cpu = 00:00:15 ; elapsed = 00:00:04 . Memory (MB): peak = 1399.926 ; gain = 16.125
Phase 4.1 Post Commit Optimization | Checksum: d164da29

Time (s): cpu = 00:00:15 ; elapsed = 00:00:04 . Memory (MB): peak = 1399.926 ; gain = 16.125

Phase 4.2 Post Placement Cleanup
Phase 4.2 Post Placement Cleanup | Checksum: d164da29

Time (s): cpu = 00:00:15 ; elapsed = 00:00:04 . Memory (MB): peak = 1399.926 ; gain = 16.125

Phase 4.3 Placer Reporting
Phase 4.3 Placer Reporting | Checksum: d164da29

Time (s): cpu = 00:00:15 ; elapsed = 00:00:04 . Memory (MB): peak = 1399.926 ; gain = 16.125

Phase 4.4 Final Placement Cleanup
Netlist sorting complete. Time (s): cpu = 00:00:00 ; elapsed = 00:00:00 . Memory (MB): peak = 1399.926 ; gain = 0.000
Phase 4.4 Final Placement Cleanup | Checksum: 14a7d4857

Time (s): cpu = 00:00:15 ; elapsed = 00:00:04 . Memory (MB): peak = 1399.926 ; gain = 16.125
Phase 4 Post Placement Optimization and Clean-Up | Checksum: 14a7d4857

Time (s): cpu = 00:00:15 ; elapsed = 00:00:04 . Memory (MB): peak = 1399.926 ; gain = 16.125
Ending Placer Task | Checksum: f969a077

Time (s): cpu = 00:00:15 ; elapsed = 00:00:04 . Memory (MB): peak = 1399.926 ; gain = 16.125
INFO: [Common 17-83] Releasing license: Implementation
53 Infos, 7 Warnings, 7 Critical Warnings and 0 Errors encountered.
place_design completed successfully
INFO: [Common 17-600] The following parameters have non-default value.
general.maxThreads
Netlist sorting complete. Time (s): cpu = 00:00:00 ; elapsed = 00:00:00 . Memory (MB): peak = 1399.926 ; gain = 0.000
INFO: [Timing 38-480] Writing timing data to binary archive.
Writing placer database...
Netlist sorting complete. Time (s): cpu = 00:00:00 ; elapsed = 00:00:00 . Memory (MB): peak = 1407.539 ; gain = 0.000
Writing XDEF routing.
Writing XDEF routing logical nets.
Writing XDEF routing special nets.
Write XDEF Complete: Time (s): cpu = 00:00:00 ; elapsed = 00:00:00.099 . Memory (MB): peak = 1407.539 ; gain = 7.613
INFO: [Common 17-1381] The checkpoint 'e:/vivado/Vivado_Learning/prj/xilinx/Vivado_Learning.runs/impl_1/computer_placed.dcp' has been generated.
INFO: [runtcl-4] Executing : report_io -file computer_io_placed.rpt
report_io: Time (s): cpu = 00:00:00 ; elapsed = 00:00:00.029 . Memory (MB): peak = 1407.539 ; gain = 0.000
INFO: [runtcl-4] Executing : report_utilization -file computer_utilization_placed.rpt -pb computer_utilization_placed.pb
INFO: [runtcl-4] Executing : report_control_sets -verbose -file computer_control_sets_placed.rpt
report_control_sets: Time (s): cpu = 00:00:00 ; elapsed = 00:00:00.003 . Memory (MB): peak = 1407.539 ; gain = 0.000
Command: route_design
Attempting to get a license for feature 'Implementation' and/or device 'xc7a100t'
INFO: [Common 17-349] Got license for feature 'Implementation' and/or device 'xc7a100t'
Running DRC as a precondition to command route_design
INFO: [DRC 23-27] Running DRC with 8 threads
INFO: [Vivado_Tcl 4-198] DRC finished with 0 Errors
INFO: [Vivado_Tcl 4-199] Please refer to the DRC report (report_drc) for more information.


Starting Routing Task
INFO: [Route 35-254] Multithreading enabled for route_design using a maximum of 8 CPUs
Checksum: PlaceDB: f28bf18 ConstDB: 0 ShapeSum: ea40e15f RouteDB: 0

Phase 1 Build RT Design
Phase 1 Build RT Design | Checksum: 142a82691

Time (s): cpu = 00:00:17 ; elapsed = 00:00:15 . Memory (MB): peak = 1545.348 ; gain = 137.809
Post Restoration Checksum: NetGraph: b8ccd5a4 NumContArr: 89db50ed Constraints: 0 Timing: 0

Phase 2 Router Initialization

Phase 2.1 Create Timer
Phase 2.1 Create Timer | Checksum: 142a82691

Time (s): cpu = 00:00:17 ; elapsed = 00:00:15 . Memory (MB): peak = 1577.418 ; gain = 169.879

Phase 2.2 Fix Topology Constraints
Phase 2.2 Fix Topology Constraints | Checksum: 142a82691

Time (s): cpu = 00:00:17 ; elapsed = 00:00:15 . Memory (MB): peak = 1607.367 ; gain = 199.828

Phase 2.3 Pre Route Cleanup
Phase 2.3 Pre Route Cleanup | Checksum: 142a82691

Time (s): cpu = 00:00:17 ; elapsed = 00:00:15 . Memory (MB): peak = 1607.367 ; gain = 199.828
 Number of Nodes with overlaps = 0

Phase 2.4 Update Timing
Phase 2.4 Update Timing | Checksum: 1400616c3

Time (s): cpu = 00:00:18 ; elapsed = 00:00:15 . Memory (MB): peak = 1632.801 ; gain = 225.262
INFO: [Route 35-416] Intermediate Timing Summary | WNS=96.762 | TNS=0.000  | WHS=0.001  | THS=0.000  |

Phase 2 Router Initialization | Checksum: 1a1e23884

Time (s): cpu = 00:00:18 ; elapsed = 00:00:15 . Memory (MB): peak = 1632.801 ; gain = 225.262

Phase 3 Initial Routing
Phase 3 Initial Routing | Checksum: 171ad1df3

Time (s): cpu = 00:00:18 ; elapsed = 00:00:15 . Memory (MB): peak = 1632.801 ; gain = 225.262

Phase 4 Rip-up And Reroute

Phase 4.1 Global Iteration 0
 Number of Nodes with overlaps = 418
 Number of Nodes with overlaps = 1
 Number of Nodes with overlaps = 0
INFO: [Route 35-416] Intermediate Timing Summary | WNS=96.460 | TNS=0.000  | WHS=N/A    | THS=N/A    |

Phase 4.1 Global Iteration 0 | Checksum: 261595372

Time (s): cpu = 00:00:19 ; elapsed = 00:00:15 . Memory (MB): peak = 1632.801 ; gain = 225.262
Phase 4 Rip-up And Reroute | Checksum: 261595372

Time (s): cpu = 00:00:19 ; elapsed = 00:00:15 . Memory (MB): peak = 1632.801 ; gain = 225.262

Phase 5 Delay and Skew Optimization

Phase 5.1 Delay CleanUp
Phase 5.1 Delay CleanUp | Checksum: 261595372

Time (s): cpu = 00:00:19 ; elapsed = 00:00:15 . Memory (MB): peak = 1632.801 ; gain = 225.262

Phase 5.2 Clock Skew Optimization
Phase 5.2 Clock Skew Optimization | Checksum: 261595372

Time (s): cpu = 00:00:19 ; elapsed = 00:00:15 . Memory (MB): peak = 1632.801 ; gain = 225.262
Phase 5 Delay and Skew Optimization | Checksum: 261595372

Time (s): cpu = 00:00:19 ; elapsed = 00:00:15 . Memory (MB): peak = 1632.801 ; gain = 225.262

Phase 6 Post Hold Fix

Phase 6.1 Hold Fix Iter

Phase 6.1.1 Update Timing
Phase 6.1.1 Update Timing | Checksum: 250508e7a

Time (s): cpu = 00:00:19 ; elapsed = 00:00:15 . Memory (MB): peak = 1632.801 ; gain = 225.262
INFO: [Route 35-416] Intermediate Timing Summary | WNS=96.539 | TNS=0.000  | WHS=0.233  | THS=0.000  |

Phase 6.1 Hold Fix Iter | Checksum: 250508e7a

Time (s): cpu = 00:00:19 ; elapsed = 00:00:15 . Memory (MB): peak = 1632.801 ; gain = 225.262
Phase 6 Post Hold Fix | Checksum: 250508e7a

Time (s): cpu = 00:00:19 ; elapsed = 00:00:15 . Memory (MB): peak = 1632.801 ; gain = 225.262

Phase 7 Route finalize

Router Utilization Summary
  Global Vertical Routing Utilization    = 0.401575 %
  Global Horizontal Routing Utilization  = 0.516908 %
  Routable Net Status*
  *Does not include unroutable nets such as driverless and loadless.
  Run report_route_status for detailed report.
  Number of Failed Nets               = 0
  Number of Unrouted Nets             = 0
  Number of Partially Routed Nets     = 0
  Number of Node Overlaps             = 0

Phase 7 Route finalize | Checksum: 250508e7a

Time (s): cpu = 00:00:19 ; elapsed = 00:00:15 . Memory (MB): peak = 1632.801 ; gain = 225.262

Phase 8 Verifying routed nets

 Verification completed successfully
Phase 8 Verifying routed nets | Checksum: 250508e7a

Time (s): cpu = 00:00:19 ; elapsed = 00:00:15 . Memory (MB): peak = 1632.801 ; gain = 225.262

Phase 9 Depositing Routes
Phase 9 Depositing Routes | Checksum: 1d806d5ed

Time (s): cpu = 00:00:19 ; elapsed = 00:00:16 . Memory (MB): peak = 1632.801 ; gain = 225.262

Phase 10 Post Router Timing
INFO: [Route 35-57] Estimated Timing Summary | WNS=96.539 | TNS=0.000  | WHS=0.233  | THS=0.000  |

INFO: [Route 35-327] The final timing numbers are based on the router estimated timing analysis. For a complete and accurate timing signoff, please run report_timing_summary.
Phase 10 Post Router Timing | Checksum: 1d806d5ed

Time (s): cpu = 00:00:19 ; elapsed = 00:00:16 . Memory (MB): peak = 1632.801 ; gain = 225.262
INFO: [Route 35-16] Router Completed Successfully

Time (s): cpu = 00:00:19 ; elapsed = 00:00:16 . Memory (MB): peak = 1632.801 ; gain = 225.262

Routing Is Done.
INFO: [Common 17-83] Releasing license: Implementation
71 Infos, 7 Warnings, 7 Critical Warnings and 0 Errors encountered.
route_design completed successfully
route_design: Time (s): cpu = 00:00:19 ; elapsed = 00:00:16 . Memory (MB): peak = 1632.801 ; gain = 225.262
INFO: [Common 17-600] The following parameters have non-default value.
general.maxThreads
Netlist sorting complete. Time (s): cpu = 00:00:00 ; elapsed = 00:00:00 . Memory (MB): peak = 1632.801 ; gain = 0.000
INFO: [Timing 38-480] Writing timing data to binary archive.
Writing placer database...
Netlist sorting complete. Time (s): cpu = 00:00:00 ; elapsed = 00:00:00 . Memory (MB): peak = 1632.801 ; gain = 0.000
Writing XDEF routing.
Writing XDEF routing logical nets.
Writing XDEF routing special nets.
Write XDEF Complete: Time (s): cpu = 00:00:00 ; elapsed = 00:00:00.122 . Memory (MB): peak = 1632.801 ; gain = 0.000
INFO: [Common 17-1381] The checkpoint 'e:/vivado/Vivado_Learning/prj/xilinx/Vivado_Learning.runs/impl_1/computer_routed.dcp' has been generated.
INFO: [runtcl-4] Executing : report_drc -file computer_drc_routed.rpt -pb computer_drc_routed.pb -rpx computer_drc_routed.rpx
Command: report_drc -file computer_drc_routed.rpt -pb computer_drc_routed.pb -rpx computer_drc_routed.rpx
INFO: [IP_Flow 19-1839] IP Catalog is up to date.
INFO: [DRC 23-27] Running DRC with 8 threads
INFO: [Coretcl 2-168] The results of DRC are in file e:/vivado/Vivado_Learning/prj/xilinx/Vivado_Learning.runs/impl_1/computer_drc_routed.rpt.
report_drc completed successfully
INFO: [runtcl-4] Executing : report_methodology -file computer_methodology_drc_routed.rpt -pb computer_methodology_drc_routed.pb -rpx computer_methodology_drc_routed.rpx
Command: report_methodology -file computer_methodology_drc_routed.rpt -pb computer_methodology_drc_routed.pb -rpx computer_methodology_drc_routed.rpx
INFO: [Timing 38-35] Done setting XDC timing constraints.
INFO: [DRC 23-133] Running Methodology with 8 threads
INFO: [Coretcl 2-1520] The results of Report Methodology are in file e:/vivado/Vivado_Learning/prj/xilinx/Vivado_Learning.runs/impl_1/computer_methodology_drc_routed.rpt.
report_methodology completed successfully
INFO: [runtcl-4] Executing : report_power -file computer_power_routed.rpt -pb computer_power_summary_routed.pb -rpx computer_power_routed.rpx
Command: report_power -file computer_power_routed.rpt -pb computer_power_summary_routed.pb -rpx computer_power_routed.rpx
INFO: [Timing 38-35] Done setting XDC timing constraints.
Running Vector-less Activity Propagation...

Finished Running Vector-less Activity Propagation
84 Infos, 7 Warnings, 7 Critical Warnings and 0 Errors encountered.
report_power completed successfully
INFO: [runtcl-4] Executing : report_route_status -file computer_route_status.rpt -pb computer_route_status.pb
INFO: [runtcl-4] Executing : report_timing_summary -max_paths 10 -file computer_timing_summary_routed.rpt -pb computer_timing_summary_routed.pb -rpx computer_timing_summary_routed.rpx -warn_on_violation 
INFO: [Timing 38-91] UpdateTimingParams: Speed grade: -1, Delay Type: min_max.
INFO: [Timing 38-191] Multithreading enabled for timing update using a maximum of 8 CPUs
INFO: [runtcl-4] Executing : report_incremental_reuse -file computer_incremental_reuse_routed.rpt
INFO: [Vivado_Tcl 4-1062] Incremental flow is disabled. No incremental reuse Info to report.
INFO: [runtcl-4] Executing : report_clock_utilization -file computer_clock_utilization_routed.rpt
INFO: [runtcl-4] Executing : report_bus_skew -warn_on_violation -file computer_bus_skew_routed.rpt -pb computer_bus_skew_routed.pb -rpx computer_bus_skew_routed.rpx
INFO: [Timing 38-91] UpdateTimingParams: Speed grade: -1, Delay Type: min_max.
INFO: [Timing 38-191] Multithreading enabled for timing update using a maximum of 8 CPUs
INFO: [Common 17-206] Exiting Vivado at Fri Dec  5 20:22:20 2025...

*** Running vivado
    with args -log computer.vdi -applog -m64 -product Vivado -messageDb vivado.pb -mode batch -source computer.tcl -notrace


****** Vivado v2018.3 (64-bit)
  **** SW Build 2405991 on Thu Dec  6 23:38:27 MST 2018
  **** IP Build 2404404 on Fri Dec  7 01:43:56 MST 2018
    ** Copyright 1986-2018 Xilinx, Inc. All Rights Reserved.

source computer.tcl -notrace
Command: open_checkpoint computer_routed.dcp

Starting open_checkpoint Task

Time (s): cpu = 00:00:00 ; elapsed = 00:00:00.017 . Memory (MB): peak = 249.961 ; gain = 0.000
INFO: [Netlist 29-17] Analyzing 48 Unisim elements for replacement
INFO: [Netlist 29-28] Unisim Transformation completed in 1 CPU seconds
INFO: [Project 1-479] Netlist was created with Vivado 2018.3
INFO: [Device 21-403] Loading part xc7a100tcsg324-1
INFO: [Project 1-570] Preparing netlist for logic optimization
INFO: [Timing 38-478] Restoring timing data from binary archive.
INFO: [Timing 38-479] Binary timing data restore complete.
INFO: [Project 1-856] Restoring constraints from binary archive.
INFO: [Project 1-853] Binary constraint restore complete.
Reading XDEF placement.
Reading placer database...
Reading XDEF routing.
Read XDEF File: Time (s): cpu = 00:00:00 ; elapsed = 00:00:00.150 . Memory (MB): peak = 1237.945 ; gain = 1.707
Restored from archive | CPU: 0.000000 secs | Memory: 0.000000 MB |
Finished XDEF File Restore: Time (s): cpu = 00:00:00 ; elapsed = 00:00:00.150 . Memory (MB): peak = 1237.945 ; gain = 1.707
Netlist sorting complete. Time (s): cpu = 00:00:00 ; elapsed = 00:00:00 . Memory (MB): peak = 1237.977 ; gain = 0.000
INFO: [Project 1-111] Unisim Transformation Summary:
No Unisim elements were transformed.

INFO: [Project 1-604] Checkpoint was created with Vivado v2018.3 (64-bit) build 2405991
open_checkpoint: Time (s): cpu = 00:00:09 ; elapsed = 00:00:10 . Memory (MB): peak = 1237.977 ; gain = 988.016
Command: write_bitstream -force computer.bit
Attempting to get a license for feature 'Implementation' and/or device 'xc7a100t'
INFO: [Common 17-349] Got license for feature 'Implementation' and/or device 'xc7a100t'
Running DRC as a precondition to command write_bitstream
INFO: [IP_Flow 19-234] Refreshing IP repositories
INFO: [IP_Flow 19-1704] No user IP repositories specified
INFO: [IP_Flow 19-2313] Loaded Vivado IP repository 'C:/Xilinx/Vivado/2018.3/data/ip'.
INFO: [DRC 23-27] Running DRC with 8 threads
WARNING: [DRC CFGBVS-1] Missing CFGBVS and CONFIG_VOLTAGE Design Properties: Neither the CFGBVS nor CONFIG_VOLTAGE voltage property is set in the current_design.  Configuration bank voltage select (CFGBVS) must be set to VCCO or GND, and CONFIG_VOLTAGE must be set to the correct configuration voltage, in order to determine the I/O voltage support for the pins in bank 0.  It is suggested to specify these either using the 'Edit Device Properties' function in the GUI or directly in the XDC file using the following syntax:

 set_property CFGBVS value1 [current_design]
 #where value1 is either VCCO or GND

 set_property CONFIG_VOLTAGE value2 [current_design]
 #where value2 is the voltage provided to configuration bank 0

Refer to the device configuration user guide for more information.
INFO: [Vivado 12-3199] DRC finished with 0 Errors, 1 Warnings
INFO: [Vivado 12-3200] Please refer to the DRC report (report_drc) for more information.
INFO: [Designutils 20-2272] Running write_bitstream with 8 threads.
Loading data files...
Loading site data...
Loading route data...
Processing options...
Creating bitmap...
Creating bitstream...
Writing bitstream ./computer.bit...
INFO: [Vivado 12-1842] Bitgen Completed Successfully.
INFO: [Project 1-120] WebTalk data collection is mandatory when using a WebPACK part without a full Vivado license. To see the specific WebTalk data collected for your design, open the usage_statistics_webtalk.html or usage_statistics_webtalk.xml file in the implementation directory.
INFO: [Common 17-83] Releasing license: Implementation
22 Infos, 1 Warnings, 0 Critical Warnings and 0 Errors encountered.
write_bitstream completed successfully
write_bitstream: Time (s): cpu = 00:00:11 ; elapsed = 00:00:09 . Memory (MB): peak = 1753.676 ; gain = 515.699
INFO: [Common 17-206] Exiting Vivado at Fri Dec  5 20:22:58 2025...
